{
  "schema_version": "2.0",
  "file": "clean.docx",
  "standard": "ISO/IEC 29500-1:2008 Strict",
  "tool": {
    "name": "strict-ooxml-test",
    "version": "0.1.0"
  },
  "conformance": {
    "declared": "strict",
    "detected": "strict",
    "normalized": false
  },
  "overall_status": "supported",
  "summary": {
    "supported": 3,
    "partial": 0,
    "unsupported": 0,
    "ignored": 0,
    "error": 0
  },
  "features": [
    {
      "feature_id": "w:p",
      "status": "supported",
      "severity": "info",
      "locations": [
        "/word/document.xml:1:1"
      ],
      "count": 1
    },
    {
      "feature_id": "w:r",
      "status": "supported",
      "severity": "info",
      "locations": [
        "/word/document.xml:1:4"
      ],
      "count": 1
    },
    {
      "feature_id": "w:t",
      "status": "supported",
      "severity": "info",
      "locations": [
        "/word/document.xml:1:7"
      ],
      "count": 1
    }
  ],
  "normalization": {
    "applied": [],
    "losses": [],
    "invariants_ok": true
  }
}
